### ISSUE TITLE
OC 0.3.0 web ui does't work in DMZ

### ISSUE THREAD

**Issue by klugd** [OpenCentauri/cc-fw-tools#72]
With the original firmware the printer was connected to my guest wifi network in DMZ and I could access it on the computers from the internal lan.

I have installed the OC 0.3.0.

If the printer is still in the DMZ, I can ping it, I can login via ssh, I access the web page (can see the OC logo, the the black frames with the switches, but none of the switches or the camera is active. On the camera page is the error text which use to be if printer is disconnected.

If the printer connected to the internal wifi lan, I can access the web too (after some reboot).

**Comment by suchmememanyskill** [comment]
Please screenshot the first set of messages, and copy paste them into a file or something

**Comment by suchmememanyskill** [comment]
Unsure actually if this is the issue or just something that per chance fixes this. I haven't been home in the last few days so have been unable to debug, but i'm starting to suspect this is a race condition. You can consistently trigger the same error when connected to ethernet.

**Comment by klugd** [comment]
I made some tcpdumps in my DMZ vlan. The printer is pinging more or less continously its getway ip. I guess if this is not success, thw websocket is not working properly. The questins: is this a race condition, or some kind of dependency..
And the root question, why is this ping exists/needs at all? thx
 
07:26:14.650366 IP Centauri-Carbon.lan > core0.lan: ICMP echo request, id 48615, seq 35454, length 8
07:26:14.650692 IP core0.lan > Centauri-Carbon.lan: ICMP echo reply, id 48615, seq 35454, length 8
07:26:14.650397 IP Centauri-Carbon.lan > core0.lan: ICMP echo request, id 14725, seq 8704, length 8
07:26:14.650826 IP core0.lan > Centauri-Carbon.lan: ICMP echo reply, id 14725, seq 8704, length 8
07:26:19.297860 IP Centauri-Carbon.lan > core0.lan: ICMP echo request, id 3325, seq 12496, length 8
07:26:19.298180 IP core0.lan > Centauri-Carbon.lan: ICMP echo reply, id 3325, seq 12496, length 8
07:26:24.298791 IP Centauri-Carbon.lan > core0.lan: ICMP echo request, id 36387, seq 37216, length 8

**Comment by nikilase** [comment]
Just want to mention I had the same issues with the OpenCentauri Firmware.
Default Firmware worked fine in DMZ and normal LAN, even though ICMP to Firewall (I think ICMP in general) was disallowed in my OPNsense Firewall. 
OpenCentauri only worked in normal LAN, not DMZ.

Fixed it for OpenCentauri by allowing ICMP to the Firewall on my OPNsense Firewall.
Not sure why OpenCentauri needs ICMP to my Firewall to work and the default Firmware does not need it but that's an easy fix at least for me.

**Comment by PeterFeicht** [comment]
~I don't have anything blocked from the printer (ping to the gateway is allowed, outgoing traffic to the internet is allowed), and my machine is in the same subnet, but I also have the same problem. I rarely encountered the same symptoms with the stock firmware (didn't check error messages at the time, so I can't be sure it's the same cause), but a reboot always solved it.~

~The links @klugd shared don't work any more, but the console error message is the same for me.~

My bad, I just double checked my router configuration and it turns out that I did accidentally block IPv4 ping. Allowing it indeed fixes the issue 🥳
